{
  "id": "greeting_graph",
  "version": "1.0",
  "schema_version": "1.0.0",
  "kind": "graph",
  "nodes": [
    {
      "id": "greet",
      "type": "transform",
      "config": {
        "transform": "template",
        "template": "Hello, {{.name}}! Welcome to PetalFlow.",
        "output_var": "greeting"
      }
    }
  ],
  "edges": [],
  "entry": "greet"
}
